{
  "id": "amap-v1",
  "kind": "app",
  "targetPackages": ["com.autonavi.minimap"],
  "name": "高德地图专家",
  "version": 1,
  "priority": 10,
  "author": "system",
  "activation": {
    "intents": ["app.use.amap"],
    "taskKeywords": ["高德", "高德地图", "amap", "导航", "路线"],
    "packages": ["com.autonavi.minimap"],
    "manufacturers": ["*"],
    "androidApiMin": 26,
    "taskScoped": false,
    "surfaceScoped": true
  },
  "capabilities": ["app.amap"]
}
