{
  "id": "android-system-dialogs-v1",
  "kind": "system",
  "targetPackages": [],
  "name": "Android 系统弹窗",
  "version": 1,
  "priority": 88,
  "author": "system",
  "activation": {
    "intents": ["system.dialog"],
    "taskKeywords": ["权限弹窗", "系统弹窗", "确认弹窗", "打开方式", "风险提示"],
    "packages": ["com.android.permissioncontroller", "com.google.android.permissioncontroller", "com.android.packageinstaller", "com.miui.packageinstaller"],
    "manufacturers": ["*"],
    "androidApiMin": 26,
    "taskScoped": false,
    "surfaceScoped": true
  },
  "capabilities": ["system.dialog"]
}
